{
  "$schema": "https://json-schema.org/draft/2020-12/schema",
  "$id": "https://github.com/lxsdd/dj-metadata-normalizer/rules/schema-v2.json",
  "title": "DJ Metadata Normalizer ruleset v2",
  "type": "object",
  "additionalProperties": false,
  "required": ["schema_version", "ruleset_id", "revision", "rules"],
  "properties": {
    "schema_version": { "const": 2 },
    "ruleset_id": { "type": "string", "minLength": 1 },
    "revision": { "type": "string", "minLength": 1 },
    "rules": {
      "type": "array",
      "items": {
        "type": "object",
        "additionalProperties": false,
        "required": ["id", "enabled", "priority", "fields", "match", "transform", "safety", "source"],
        "properties": {
          "id": { "type": "string", "pattern": "^[a-z0-9][a-z0-9._-]+$" },
          "enabled": { "type": "boolean" },
          "priority": { "type": "integer" },
          "fields": {
            "type": "array",
            "minItems": 1,
            "items": { "type": "string", "minLength": 1 }
          },
          "match": {
            "type": "object",
            "additionalProperties": false,
            "required": ["kind"],
            "properties": {
              "kind": { "enum": ["always", "exact"] },
              "value": { "type": "string" },
              "case_sensitive": { "type": "boolean" }
            }
          },
          "transform": {
            "type": "object",
            "additionalProperties": false,
            "required": ["kind"],
            "properties": {
              "kind": { "enum": ["normalize_unicode_whitespace", "trim_whitespace", "collapse_whitespace", "replace_with"] },
              "replacement": { "type": "string" }
            }
          },
          "safety": { "enum": ["SAFE", "CONFIDENT", "REVIEW"] },
          "source": {
            "type": "object",
            "additionalProperties": false,
            "required": ["kind", "rationale"],
            "properties": {
              "kind": { "enum": ["builtin", "migrated_masstagger", "user_correction", "manual"] },
              "rationale": { "type": "string", "minLength": 1 },
              "reference": { "type": "string" }
            }
          }
        }
      }
    }
  }
}
